{
  "schema_version": "1.0.0",
  "document_id": "fixture-doc-1",
  "source": {
    "filename": "fixture.pdf",
    "media_type": "application/pdf",
    "sha256": "0000000000000000000000000000000000000000000000000000000000000000",
    "page_count": 1
  },
  "taxonomy": {
    "name": "planimetry-atomic-taxonomy",
    "version": "1.0.0",
    "sha256": "1111111111111111111111111111111111111111111111111111111111111111"
  },
  "run": {
    "producer": "decomposer",
    "producer_version": "0.1.0",
    "created_at": "2026-02-07T11:00:00Z",
    "config_sha256": "3333333333333333333333333333333333333333333333333333333333333333",
    "model_versions": {"geometry": "g-0.1", "ocr": "o-0.1"}
  },
  "dataset_status": "draft",
  "pages": [
    {
      "id": "p1",
      "page_index": 0,
      "width_px": 800,
      "height_px": 600,
      "render_dpi": 200,
      "rotation_deg": 0,
      "observations": [
        {"id": "p-roomA", "layer": "architectural_candidate", "class_id": "room_region",
         "geometry": {"type": "polygon", "points": [[2,0],[100,0],[100,98],[0,100]]},
         "evidence": {"page_id": "p1", "crop_bbox_px": [0,0,100,100]},
         "confidence": {"score": 0.9, "abstained": false, "reasons": []},
         "provenance": {"method": "model", "producer": "decomposer", "producer_version": "0.1.0", "created_at": "2026-02-07T11:00:00Z", "derived_from": []},
         "reviews": [], "attributes": {}},
        {"id": "p-roomB", "layer": "architectural_candidate", "class_id": "room_region",
         "geometry": {"type": "polygon", "points": [[100,0],[200,0],[200,100],[100,100]]},
         "evidence": {"page_id": "p1", "crop_bbox_px": [100,0,100,100]},
         "confidence": {"score": 0.95, "abstained": false, "reasons": []},
         "provenance": {"method": "model", "producer": "decomposer", "producer_version": "0.1.0", "created_at": "2026-02-07T11:00:00Z", "derived_from": []},
         "reviews": [], "attributes": {}},
        {"id": "p-roomC", "layer": "architectural_candidate", "class_id": "room_region",
         "geometry": {"type": "polygon", "points": [[500,500],[560,500],[560,560],[500,560]]},
         "evidence": {"page_id": "p1", "crop_bbox_px": [500,500,60,60]},
         "confidence": {"score": 0.55, "abstained": false, "reasons": []},
         "provenance": {"method": "model", "producer": "decomposer", "producer_version": "0.1.0", "created_at": "2026-02-07T11:00:00Z", "derived_from": []},
         "reviews": [], "attributes": {}},
        {"id": "p-wall", "layer": "architectural_candidate", "class_id": "wall_axis",
         "geometry": {"type": "polyline", "points": [[0,0],[205,0]]},
         "evidence": {"page_id": "p1", "crop_bbox_px": [0,0,205,2]},
         "confidence": {"score": 0.8, "abstained": false, "reasons": []},
         "provenance": {"method": "model", "producer": "decomposer", "producer_version": "0.1.0", "created_at": "2026-02-07T11:00:00Z", "derived_from": []},
         "reviews": [], "attributes": {}},
        {"id": "p-door", "layer": "architectural_candidate", "class_id": "door",
         "geometry": {"type": "point", "points": [[104,52]]},
         "evidence": {"page_id": "p1", "crop_bbox_px": [99,47,10,10]},
         "confidence": {"score": 0.7, "abstained": false, "reasons": []},
         "provenance": {"method": "model", "producer": "decomposer", "producer_version": "0.1.0", "created_at": "2026-02-07T11:00:00Z", "derived_from": []},
         "reviews": [], "attributes": {}},
        {"id": "p-label", "layer": "text", "class_id": "room_label",
         "geometry": {"type": "bbox", "bbox": [41,40,20,10]},
         "evidence": {"page_id": "p1", "crop_bbox_px": [41,40,20,10]},
         "confidence": {"score": 0.85, "abstained": false, "reasons": []},
         "provenance": {"method": "model", "producer": "decomposer", "producer_version": "0.1.0", "created_at": "2026-02-07T11:00:00Z", "derived_from": []},
         "reviews": [], "attributes": {"text": "Cucna"}},
        {"id": "p-scale", "layer": "measurement", "class_id": "drawing_scale",
         "geometry": {"type": "point", "points": [[11,190]]},
         "evidence": {"page_id": "p1", "crop_bbox_px": [11,185,40,12]},
         "confidence": {"score": 0.6, "abstained": false, "reasons": []},
         "provenance": {"method": "model", "producer": "decomposer", "producer_version": "0.1.0", "created_at": "2026-02-07T11:00:00Z", "derived_from": []},
         "reviews": [], "attributes": {"value": 105}},
        {"id": "p-abstain", "layer": "geometry", "class_id": "unknown_geometry",
         "geometry": {"type": "point", "points": [[300,300]]},
         "evidence": {"page_id": "p1", "crop_bbox_px": [295,295,10,10]},
         "confidence": {"score": 0.2, "abstained": true, "reasons": ["low_evidence"]},
         "provenance": {"method": "model", "producer": "decomposer", "producer_version": "0.1.0", "created_at": "2026-02-07T11:00:00Z", "derived_from": []},
         "reviews": [], "attributes": {}}
      ],
      "relationships": [
        {"id": "p-rel1", "type": "labels", "from_id": "p-label", "to_id": "p-roomA", "confidence": 0.8,
         "provenance": {"method": "model", "producer": "decomposer", "producer_version": "0.1.0", "created_at": "2026-02-07T11:00:00Z", "derived_from": []},
         "reviews": []}
      ]
    }
  ]
}
