{
  "schema_version": "1.0.0",
  "document_id": "fixture-doc-1",
  "source": {
    "filename": "fixture.pdf",
    "media_type": "application/pdf",
    "sha256": "0000000000000000000000000000000000000000000000000000000000000000",
    "page_count": 1
  },
  "taxonomy": {
    "name": "planimetry-atomic-taxonomy",
    "version": "1.0.0",
    "sha256": "1111111111111111111111111111111111111111111111111111111111111111"
  },
  "run": {
    "producer": "ground-truth",
    "producer_version": "1.0.0",
    "created_at": "2026-02-07T10:00:00Z",
    "config_sha256": "2222222222222222222222222222222222222222222222222222222222222222",
    "model_versions": {"human": "gt-1"}
  },
  "dataset_status": "frozen_ground_truth",
  "pages": [
    {
      "id": "p1",
      "page_index": 0,
      "width_px": 800,
      "height_px": 600,
      "render_dpi": 200,
      "rotation_deg": 0,
      "observations": [
        {"id": "gt-roomA", "layer": "architectural_candidate", "class_id": "room_region",
         "geometry": {"type": "polygon", "points": [[0,0],[100,0],[100,100],[0,100]]},
         "evidence": {"page_id": "p1", "crop_bbox_px": [0,0,100,100]},
         "confidence": {"score": 1.0, "abstained": false, "reasons": []},
         "provenance": {"method": "human", "producer": "gt", "producer_version": "1", "created_at": "2026-02-07T10:00:00Z", "derived_from": []},
         "reviews": [], "attributes": {}},
        {"id": "gt-roomB", "layer": "architectural_candidate", "class_id": "room_region",
         "geometry": {"type": "polygon", "points": [[100,0],[200,0],[200,100],[100,100]]},
         "evidence": {"page_id": "p1", "crop_bbox_px": [100,0,100,100]},
         "confidence": {"score": 1.0, "abstained": false, "reasons": []},
         "provenance": {"method": "human", "producer": "gt", "producer_version": "1", "created_at": "2026-02-07T10:00:00Z", "derived_from": []},
         "reviews": [], "attributes": {}},
        {"id": "gt-wall", "layer": "architectural_candidate", "class_id": "wall_axis",
         "geometry": {"type": "polyline", "points": [[0,0],[200,0]]},
         "evidence": {"page_id": "p1", "crop_bbox_px": [0,0,200,2]},
         "confidence": {"score": 1.0, "abstained": false, "reasons": []},
         "provenance": {"method": "human", "producer": "gt", "producer_version": "1", "created_at": "2026-02-07T10:00:00Z", "derived_from": []},
         "reviews": [], "attributes": {}},
        {"id": "gt-door", "layer": "architectural_candidate", "class_id": "door",
         "geometry": {"type": "point", "points": [[100,50]]},
         "evidence": {"page_id": "p1", "crop_bbox_px": [95,45,10,10]},
         "confidence": {"score": 1.0, "abstained": false, "reasons": []},
         "provenance": {"method": "human", "producer": "gt", "producer_version": "1", "created_at": "2026-02-07T10:00:00Z", "derived_from": []},
         "reviews": [], "attributes": {}},
        {"id": "gt-window", "layer": "architectural_candidate", "class_id": "window",
         "geometry": {"type": "point", "points": [[50,0]]},
         "evidence": {"page_id": "p1", "crop_bbox_px": [45,0,10,4]},
         "confidence": {"score": 1.0, "abstained": false, "reasons": []},
         "provenance": {"method": "human", "producer": "gt", "producer_version": "1", "created_at": "2026-02-07T10:00:00Z", "derived_from": []},
         "reviews": [], "attributes": {}},
        {"id": "gt-label", "layer": "text", "class_id": "room_label",
         "geometry": {"type": "bbox", "bbox": [40,40,20,10]},
         "evidence": {"page_id": "p1", "crop_bbox_px": [40,40,20,10]},
         "confidence": {"score": 1.0, "abstained": false, "reasons": []},
         "provenance": {"method": "human", "producer": "gt", "producer_version": "1", "created_at": "2026-02-07T10:00:00Z", "derived_from": []},
         "reviews": [], "attributes": {"text": "Cucina"}},
        {"id": "gt-scale", "layer": "measurement", "class_id": "drawing_scale",
         "geometry": {"type": "point", "points": [[10,190]]},
         "evidence": {"page_id": "p1", "crop_bbox_px": [10,185,40,12]},
         "confidence": {"score": 1.0, "abstained": false, "reasons": []},
         "provenance": {"method": "human", "producer": "gt", "producer_version": "1", "created_at": "2026-02-07T10:00:00Z", "derived_from": []},
         "reviews": [], "attributes": {"value": 100}}
      ],
      "relationships": [
        {"id": "gt-rel1", "type": "labels", "from_id": "gt-label", "to_id": "gt-roomA", "confidence": 1.0,
         "provenance": {"method": "human", "producer": "gt", "producer_version": "1", "created_at": "2026-02-07T10:00:00Z", "derived_from": []},
         "reviews": []}
      ]
    }
  ]
}
